{
 "source": "core-c",
 "repo": "meir7651231-ui/maor-system",
 "ref": "catalog/core@b9449012",
 "generatedAt": null,
 "parts": [
  {
   "id": "core-c:catalog/core/by-distance.mjs#byDistance",
   "source": "core-c",
   "path": "catalog/core/by-distance.mjs",
   "symbol": "byDistance",
   "lang": "js",
   "what": "brick",
   "name": "ממיין נקודות לפי המרחק מהמוצא",
   "does": "הקרובה למוצא קודם; אותו מרחק ⇒ לפי x ואז y — הסדר לא תלוי באיך שהגיעו.",
   "takes": [
    {
     "name": "points",
     "kind": "geo",
     "type": "{x, y}[]"
    },
    {
     "name": "from",
     "kind": "geo",
     "type": "{x, y}"
    }
   ],
   "gives": {
    "kind": "geo",
    "type": "{x, y}[]"
   },
   "pure": true,
   "example": {
    "in": {
     "points": [
      {
       "x": 5,
       "y": 0
      },
      {
       "x": 1,
       "y": 1
      },
      {
       "x": 0,
       "y": 3
      }
     ],
     "from": {
      "x": 0,
      "y": 0
     }
    },
    "out": [
     {
      "x": 1,
      "y": 1
     },
     {
      "x": 0,
      "y": 3
     },
     {
      "x": 5,
      "y": 0
     }
    ]
   },
   "tags": [
    "core",
    "verb:sort",
    "world-free"
   ],
   "origins": [
    {
     "repo": "maor-system",
     "file": "src/lib/three-scene.ts",
     "line": 122,
     "what": "cand.push([a.distanceToSquared(nodes[j]), j]); cand.sort((p, q) => p[0] - q[0]) — השכנים לפי מרחק"
    },
    {
     "repo": "maor-system",
     "file": "src/components/parnasa/envelope.ts",
     "line": 187,
     "what": "Math.min(m, Math.hypot(n.x - px, n.y - py)) — המרחק לנקודה הקרובה"
    }
   ]
  },
  {
   "id": "core-c:catalog/core/dedupe-points.mjs#dedupePoints",
   "source": "core-c",
   "path": "catalog/core/dedupe-points.mjs",
   "symbol": "dedupePoints",
   "lang": "js",
   "what": "brick",
   "name": "מסנן כפולים: כל נקודה פעם אחת",
   "does": "כל מקום (x,y) נשאר פעם אחת — הראשון שהגיע, בסדר המקורי.",
   "takes": [
    {
     "name": "points",
     "kind": "geo",
     "type": "{x, y}[]"
    }
   ],
   "gives": {
    "kind": "geo",
    "type": "{x, y}[]"
   },
   "pure": true,
   "example": {
    "in": {
     "points": [
      {
       "x": 1,
       "y": 1
      },
      {
       "x": 2,
       "y": 0
      },
      {
       "x": 1,
       "y": 1
      }
     ]
    },
    "out": [
     {
      "x": 1,
      "y": 1
     },
     {
      "x": 2,
      "y": 0
     }
    ]
   },
   "tags": [
    "core",
    "verb:dedupe",
    "world-free"
   ],
   "origins": [
    {
     "repo": "maor-system",
     "file": "src/lib/three-scene.ts",
     "line": 128,
     "what": "if (seen.has(key)) continue; seen.add(key) — כל קשת פעם אחת"
    },
    {
     "repo": "maor-system",
     "file": "src/components/parnasa/envelope.ts",
     "line": 170,
     "what": "if (seen.has(k)) r.splice(i, 1); else seen.add(k) — עסק לא מופיע פעמיים במעטפה"
    },
    {
     "repo": "buildsmart",
     "file": "functions/src/push.ts",
     "line": 51,
     "what": "const unique = [...new Set(uids.filter(…))] — כל נמען פעם אחת"
    }
   ]
  },
  {
   "id": "core-c:catalog/core/drift.mjs#drift",
   "source": "core-c",
   "path": "catalog/core/drift.mjs",
   "symbol": "drift",
   "lang": "js",
   "what": "brick",
   "name": "מזיז נקודה במהירות שלה כמה צעדים",
   "does": "אחרי steps צעדים: x ועוד vx כפול הצעדים, y ועוד vy כפול הצעדים. הזזה ב-0 לא עושה כלום.",
   "takes": [
    {
     "name": "point",
     "kind": "geo",
     "type": "{x, y}"
    },
    {
     "name": "steps",
     "kind": "number",
     "type": "number"
    },
    {
     "name": "vel",
     "kind": "geo",
     "type": "{x, y}"
    }
   ],
   "gives": {
    "kind": "geo",
    "type": "{x, y}"
   },
   "pure": true,
   "example": {
    "in": {
     "point": {
      "x": 1,
      "y": 2
     },
     "steps": 3,
     "vel": {
      "x": 2,
      "y": -1
     }
    },
    "out": {
     "x": 7,
     "y": -1
    }
   },
   "tags": [
    "core",
    "verb:offset",
    "world-free"
   ],
   "origins": [
    {
     "repo": "maor-system",
     "file": "src/components/parnasa/Ambient.tsx",
     "line": 86,
     "what": "p.x += p.vx * dt; p.y += p.vy * dt — חלקיק נישא במהירות שלו"
    },
    {
     "repo": "-ai-chat-server",
     "file": "design/capabilities-showcase.html",
     "line": 290,
     "what": "s.x+=s.vx; s.y+=s.vy — כוכב זז במהירות שלו"
    },
    {
     "repo": "maor-system",
     "file": "src/components/parnasa/bannerFx.ts",
     "line": 474,
     "what": "d.x += d.vx — טיפה בבאנר זזה הצידה"
    }
   ]
  },
  {
   "id": "core-c:catalog/core/follow-point.mjs#followPoint",
   "source": "core-c",
   "path": "catalog/core/follow-point.mjs",
   "symbol": "followPoint",
   "lang": "js",
   "what": "brick",
   "name": "מזיז נקודה חלק קבוע מהדרך למטרה",
   "does": "בכל צעד הנקודה עוברת חלק קבוע מהדרך אל המטרה — ב-x וב-y באותו צעד; לא עוברת אותה, וכשהגיעה נשארת.",
   "takes": [
    {
     "name": "spec",
     "kind": "record:followPointSpec",
     "type": "{target: {x, y}, pullPct}"
    },
    {
     "name": "current",
     "kind": "geo",
     "type": "{x, y}"
    }
   ],
   "gives": {
    "kind": "geo",
    "type": "{x, y}"
   },
   "pure": true,
   "example": {
    "in": {
     "spec": {
      "target": {
       "x": 10,
       "y": 20
      },
      "pullPct": 50
     },
     "current": {
      "x": 0,
      "y": 0
     }
    },
    "out": {
     "x": 5,
     "y": 10
    }
   },
   "tags": [
    "core",
    "verb:follow",
    "world-free"
   ],
   "origins": [
    {
     "repo": "maor-system",
     "file": "src/lib/three-scene.ts",
     "line": 257,
     "what": "tg.x += (mo.x - tg.x) * 0.05; tg.y += (mo.y - tg.y) * 0.05 — הכדור נגרר אחרי העכבר, אותו צעד על x ועל y"
    },
    {
     "repo": "-ai-chat-server",
     "file": "design/orbit-final.html",
     "line": 599,
     "what": "p.cc[0]+=(AC[0]-p.cc[0])*.03; p.cc[1]+=…; p.cc[2]+=… — אותו צעד-הליכה-אחרי לכל רכיב בנפרד"
    },
    {
     "repo": "-ai-chat-server",
     "file": "design/orbit-message.html",
     "line": 211,
     "what": "rx+=((-0.3+my*.5)-rx)*.03 — זווית המצלמה הולכת אחרי העכבר"
    }
   ]
  },
  {
   "id": "core-c:catalog/core/group-by-side.mjs#groupBySide",
   "source": "core-c",
   "path": "catalog/core/group-by-side.mjs",
   "symbol": "groupBySide",
   "lang": "js",
   "what": "brick",
   "name": "מקבץ נקודות לפי הצד של המרכז",
   "does": "כל נקודה הולכת לאזור שלה לפי הצד של המרכז (סימן של x ושל y): ארבעה אזורים, ועל הקו — אזור 0.",
   "takes": [
    {
     "name": "points",
     "kind": "geo",
     "type": "{x, y}[]"
    },
    {
     "name": "center",
     "kind": "geo",
     "type": "{x, y}"
    }
   ],
   "gives": {
    "kind": "list",
    "type": "Record<string, {x, y}[]>"
   },
   "pure": true,
   "example": {
    "in": {
     "points": [
      {
       "x": 1,
       "y": 1
      },
      {
       "x": -1,
       "y": 2
      },
      {
       "x": 3,
       "y": 5
      }
     ],
     "center": {
      "x": 0,
      "y": 0
     }
    },
    "out": {
     "++": [
      {
       "x": 1,
       "y": 1
      },
      {
       "x": 3,
       "y": 5
      }
     ],
     "-+": [
      {
       "x": -1,
       "y": 2
      }
     ]
    }
   },
   "tags": [
    "core",
    "verb:group",
    "world-free"
   ],
   "origins": [
    {
     "repo": "maor-system",
     "file": "src/lib/three-scene.ts",
     "line": 121,
     "what": "Math.sign(nodes[j].x) !== Math.sign(a.x) — כל צומת שייך לאונה לפי הצד של הסדק"
    },
    {
     "repo": "maor-system",
     "file": "src/lib/three-scene.ts",
     "line": 74,
     "what": "if (Math.abs(vx) < 0.17) continue — הסדק המרכזי: שתי אונות"
    }
   ]
  },
  {
   "id": "core-c:catalog/core/near-net.mjs#nearNet",
   "source": "core-c",
   "path": "catalog/core/near-net.mjs",
   "symbol": "nearNet",
   "lang": "js",
   "what": "brick",
   "name": "מחבר כל נקודה לשכנות הקרובות אליה",
   "does": "נקודות ⇒ רשת: כל נקודה נקשרת ל-near הנקודות הקרובות אליה, כל קשת פעם אחת, המחיר = המרחק. הנקודות נשמרות, מתווספות רק הקשתות.",
   "takes": [
    {
     "name": "spec",
     "kind": "record:netSpec",
     "type": "{points: {x, y}[], near, sources?}"
    }
   ],
   "gives": {
    "kind": "record:net",
    "type": "{points, near, sources?, edges: {a, b, w}[]}"
   },
   "pure": true,
   "example": {
    "in": {
     "spec": {
      "points": [
       {
        "x": 0,
        "y": 0
       },
       {
        "x": 3,
        "y": 0
       },
       {
        "x": 3,
        "y": 4
       }
      ],
      "near": 1
     }
    },
    "out": {
     "points": [
      {
       "x": 0,
       "y": 0
      },
      {
       "x": 3,
       "y": 0
      },
      {
       "x": 3,
       "y": 4
      }
     ],
     "near": 1,
     "edges": [
      {
       "a": 0,
       "b": 1,
       "w": 3
      },
      {
       "a": 1,
       "b": 2,
       "w": 4
      }
     ]
    }
   },
   "tags": [
    "core",
    "verb:connect",
    "world-free"
   ],
   "origins": [
    {
     "repo": "maor-system",
     "file": "src/lib/three-scene.ts",
     "line": 114,
     "what": "synapse web — לכל צומת מועמדים לפי distanceToSquared, ממוינים, שלושת הקרובים נקשרים (nearest neighbours)"
    },
    {
     "repo": "maor-system",
     "file": "src/lib/three-scene.ts",
     "line": 127,
     "what": "מפתח min_max ב-seen — כל קשת פעם אחת"
    },
    {
     "repo": "buildsmart",
     "file": "app_flutter/lib/features/card_keyboard/hop_graph.dart",
     "line": 155,
     "what": "_addCompatEdges(adj) — קודם בונים את הקשתות, אחר כך מחפשים בגרף (BFS בתוך maxHops)"
    },
    {
     "repo": "buildsmart",
     "file": "app_flutter/lib/logic/install_engine.dart",
     "line": 759,
     "what": "Least-cost search (Dijkstra) על הגרף שנבנה — הצרכן של הרשת"
    }
   ]
  },
  {
   "id": "core-c:catalog/core/nearest-point.mjs#nearestPoint",
   "source": "core-c",
   "path": "catalog/core/nearest-point.mjs",
   "symbol": "nearestPoint",
   "lang": "js",
   "what": "brick",
   "name": "בוחר את הנקודה הקרובה ביותר למוצא",